{
  "case_ref": {
    "case_id": "case_003_caregiving",
    "input_digest": "f0a73b45edb392745beec2b33fa0b0d71306e38c0e11b8763e8d6a9d76ca7dcc",
    "title": "家族介護：親のケアをどう設計するか"
  },
  "ethics": {
    "guardrails": [
      "不確実な事実を断言しない",
      "意思決定主体をユーザーから奪わない",
      "推奨には反証と代替案を併記する",
      "前提と不確実性を明示する",
      "関係者への影響と同意を考慮する"
    ],
    "notes": "M2以降で倫理ルールを拡張予定。現段階ではガードレール中心。",
    "principles_used": [
      "integrity",
      "autonomy",
      "nonmaleficence",
      "justice",
      "accountability"
    ],
    "tradeoffs": [
      {
        "between": [
          "autonomy",
          "justice"
        ],
        "mitigation": "関係者への影響を可視化し、同意可能な進め方を選ぶ",
        "severity": "medium",
        "tension": "自己決定と外部性/公正の緊張"
      }
    ]
  },
  "meta": {
    "created_at": "2026-02-22T00:00:00Z",
    "deterministic": true,
    "generator": {
      "mode": "stub",
      "name": "generator_stub",
      "version": "1.0.0"
    },
    "pocore_version": "1.0.0",
    "run_id": "case_003_expected_stub_compact_v1",
    "schema_version": "1.0",
    "seed": 0
  },
  "options": [
    {
      "action_plan": [
        {
          "step": "最小実験を設計して実施する"
        }
      ],
      "cons": [
        "進行が遅く感じる可能性"
      ],
      "description": "最小コストで試し、学びながら前進する。",
      "ethics_review": {
        "concerns": [
          "不確実な事実を断言しない",
          "前提と不確実性を明示する"
        ],
        "confidence": "medium",
        "principles_applied": [
          "integrity",
          "autonomy",
          "justice"
        ],
        "tradeoffs": [
          {
            "between": [
              "autonomy",
              "justice"
            ],
            "mitigation": "関係者影響を可視化し、同意可能な線で意思決定する",
            "severity": "medium",
            "tension": "自己決定と外部性/公正の緊張"
          }
        ]
      },
      "feasibility": {
        "confidence": "medium",
        "effort": "low",
        "timeline": "1-2 weeks"
      },
      "option_id": "opt_1",
      "pros": [
        "失敗コストを抑えられる"
      ],
      "responsibility_review": {
        "accountability_notes": "RESP_STAKEHOLDER_CONSENT_CHECK: 決裁者が不明なため、最初に意思決定者を特定する。関係者への通知・同意・相談の実施と記録を前提に進める。",
        "confidence": "medium",
        "decision_owner": "未確定（要確認）",
        "stakeholders": [
          {
            "impact": "生活の質・安全・尊厳に直結",
            "name": "親",
            "role": "当事者"
          },
          {
            "impact": "時間・お金・精神負荷に影響",
            "name": "自分",
            "role": "意思決定主体（支援者）"
          },
          {
            "impact": "負担分担・合意形成に影響",
            "name": "兄弟姉妹（いる場合）",
            "role": "協力者候補"
          },
          {
            "impact": "プランの品質に影響",
            "name": "ケアマネ/介護事業者",
            "role": "実行者"
          }
        ]
      },
      "risks": [
        {
          "mitigation": "検証項目を明文化する",
          "risk": "検証不足",
          "severity": "medium"
        }
      ],
      "title": "案A：段階的に進める",
      "uncertainty": {
        "assumptions": [],
        "known_unknowns": [],
        "overall_level": "medium",
        "reasons": []
      }
    },
    {
      "action_plan": [
        {
          "step": "不足情報を3〜5項目に絞って集める"
        }
      ],
      "cons": [
        "機会損失が起きる可能性"
      ],
      "description": "重要な不明点を埋めてから判断する。",
      "ethics_review": {
        "concerns": [
          "不確実な事実を断言しない",
          "前提と不確実性を明示する"
        ],
        "confidence": "medium",
        "principles_applied": [
          "integrity",
          "autonomy",
          "justice"
        ],
        "tradeoffs": [
          {
            "between": [
              "autonomy",
              "justice"
            ],
            "mitigation": "関係者影響を可視化し、同意可能な線で意思決定する",
            "severity": "medium",
            "tension": "自己決定と外部性/公正の緊張"
          }
        ]
      },
      "feasibility": {
        "confidence": "high",
        "effort": "low",
        "timeline": "3-5 days"
      },
      "option_id": "opt_2",
      "pros": [
        "判断精度が上がる"
      ],
      "responsibility_review": {
        "accountability_notes": "RESP_STAKEHOLDER_CONSENT_CHECK: 決裁者が不明なため、最初に意思決定者を特定する。関係者への通知・同意・相談の実施と記録を前提に進める。",
        "confidence": "medium",
        "decision_owner": "未確定（要確認）",
        "stakeholders": [
          {
            "impact": "生活の質・安全・尊厳に直結",
            "name": "親",
            "role": "当事者"
          },
          {
            "impact": "時間・お金・精神負荷に影響",
            "name": "自分",
            "role": "意思決定主体（支援者）"
          },
          {
            "impact": "負担分担・合意形成に影響",
            "name": "兄弟姉妹（いる場合）",
            "role": "協力者候補"
          },
          {
            "impact": "プランの品質に影響",
            "name": "ケアマネ/介護事業者",
            "role": "実行者"
          }
        ]
      },
      "risks": [
        {
          "mitigation": "期限と判断条件を設定する",
          "risk": "先延ばし",
          "severity": "low"
        }
      ],
      "title": "案B：情報収集してから決める",
      "uncertainty": {
        "assumptions": [],
        "known_unknowns": [],
        "overall_level": "medium",
        "reasons": []
      }
    }
  ],
  "questions": [
    {
      "assumption_if_unanswered": "決裁者は未確定として判断を保留する",
      "optional": false,
      "priority": 1,
      "question": "この意思決定の決裁者（最終承認者）は誰か？",
      "question_id": "q_stakeholder_1",
      "why_needed": "責任所在が未確定だと実行後の説明責任が崩れるため。"
    },
    {
      "assumption_if_unanswered": "主要関係者全員に事前相談が必要と仮定する",
      "optional": false,
      "priority": 1,
      "question": "関係者の同意・相談が必要な対象は誰か？",
      "question_id": "q_stakeholder_2",
      "why_needed": "外部性を受ける人の合意形成を先に設計するため。"
    },
    {
      "assumption_if_unanswered": "不利益が大きい側を保護する案を優先する",
      "optional": false,
      "priority": 2,
      "question": "影響範囲は？（誰が何を失い、何を得るか）",
      "question_id": "q_stakeholder_3",
      "why_needed": "便益と不利益の配分を記録し、公正性を検証するため。"
    },
    {
      "assumption_if_unanswered": "文書通知を48時間以内に実施すると仮定する",
      "optional": false,
      "priority": 2,
      "question": "通知・説明の方法と期限は？",
      "question_id": "q_stakeholder_4",
      "why_needed": "合意形成を実務として実行可能にするため。"
    },
    {
      "assumption_if_unanswered": "当該不明点は高リスク側に倒して扱う",
      "optional": false,
      "priority": 3,
      "question": "不明点『医師の見立て（進行予測、必要ケアレベル）』を検証するため、最短で確認できる事実は何か？",
      "question_id": "q_unknown_1",
      "why_needed": "未解消の不確実性を具体的な検証タスクへ分解するため。"
    }
  ],
  "recommendation": {
    "alternatives": [
      {
        "option_id": "opt_2",
        "when_to_choose": "不明点が多い場合"
      }
    ],
    "confidence": "medium",
    "counter": "遅いと感じる可能性がある。",
    "reason": "害を抑えつつ前進できるため。",
    "recommended_option_id": "opt_1",
    "status": "recommended"
  },
  "responsibility": {
    "accountability_notes": "RESP_STAKEHOLDER_CONSENT_CHECK: 決裁者/意思決定者が未確定なら先に確定する。RESP_IMPACT_SCOPE: 外部性があるため、通知・同意・相談の結果と合意事項を記録する。",
    "consent_considerations": [
      "RESP_STAKEHOLDER_CONSENT_CHECK: 決裁者を特定し、承認権限を確認する",
      "RESP_STAKEHOLDER_CONSENT_CHECK: 影響を受ける関係者への通知・同意・相談の要否を確認する",
      "RESP_IMPACT_SCOPE: 影響範囲（誰が何を得る/失うか）と合意内容を記録する",
      "RESP_IMPACT_SCOPE: コミュニケーション手段と期限を決め、実施ログを残す"
    ],
    "decision_owner": "未確定（要確認）",
    "stakeholders": [
      {
        "impact": "生活の質・安全・尊厳に直結",
        "name": "親",
        "role": "当事者"
      },
      {
        "impact": "時間・お金・精神負荷に影響",
        "name": "自分",
        "role": "意思決定主体（支援者）"
      },
      {
        "impact": "負担分担・合意形成に影響",
        "name": "兄弟姉妹（いる場合）",
        "role": "協力者候補"
      },
      {
        "impact": "プランの品質に影響",
        "name": "ケアマネ/介護事業者",
        "role": "実行者"
      }
    ]
  },
  "trace": {
    "steps": [
      {
        "ended_at": "2026-02-22T00:00:01Z",
        "metrics": {
          "days_to_deadline": 38,
          "options_planned": 2,
          "questions_planned": 5,
          "rules_fired": [
            "ETH_NO_OVERCLAIM_UNKNOWN",
            "ETH_STAKEHOLDER_CONSENT"
          ],
          "stakeholders_count": 4,
          "unknowns_count": 3
        },
        "name": "parse_input",
        "started_at": "2026-02-22T00:00:00Z",
        "summary": "入力を正規化し、特徴量（features）を抽出した"
      },
      {
        "ended_at": "2026-02-22T00:00:02Z",
        "metrics": {
          "options": 2
        },
        "name": "generate_options",
        "started_at": "2026-02-22T00:00:01Z",
        "summary": "特徴量に基づいて選択肢を生成した"
      },
      {
        "ended_at": "2026-02-22T00:00:03Z",
        "metrics": {
          "questions": 5
        },
        "name": "question_layer",
        "started_at": "2026-02-22T00:00:02Z",
        "summary": "不足情報を補う問いを生成した"
      },
      {
        "ended_at": "2026-02-22T00:00:04Z",
        "metrics": {
          "arbitration_code": "DEFAULT_RECOMMEND",
          "policy_snapshot": {
            "TIME_PRESSURE_DAYS": -4,
            "UNKNOWN_BLOCK": 4
          },
          "rules_fired": [
            "ETH_NO_OVERCLAIM_UNKNOWN",
            "ETH_STAKEHOLDER_CONSENT"
          ]
        },
        "name": "compose_output",
        "started_at": "2026-02-22T00:00:03Z",
        "summary": "推奨・反証・代替案を含む出力を組み立てた"
      }
    ],
    "version": "1.0"
  },
  "uncertainty": {
    "assumptions": [
      "提示された制約が正しい"
    ],
    "known_unknowns": [
      "医師の見立て（進行予測、必要ケアレベル）",
      "利用可能なサービス枠・施設の空き",
      "兄弟姉妹の協力度合い"
    ],
    "overall_level": "medium",
    "reasons": [
      "重要情報が未確定"
    ]
  }
}
